[
  {
    "id": "rift",
    "name": "Bres's Causeway",
    "minFloor": 10,
    "tileRgb": "52,44,78",
    "monsterHpMult": 1.0,
    "gravityPctBonus": -25,
    "desc": "Bres's unfinished bridge to Ériu warps the world around it. Blocks fall 25% faster.",
    "moteColor": "#e8a06a",
    "terrainType": "swamp",
    "terrainShapes": [
      "S",
      "L",
      "J",
      "O"
    ]
  },
  {
    "id": "cavern",
    "name": "Sídhe Caverns",
    "minFloor": 5,
    "tileRgb": "45,120,110",
    "monsterHpMult": 1.25,
    "gravityPctBonus": 0,
    "desc": "Otherworld light hardens all who dwell here. Monsters have +25% HP.",
    "moteColor": "#9fe3c0",
    "terrainType": "ice",
    "terrainShapes": [
      "S",
      "L",
      "J",
      "O",
      "I"
    ]
  },
  {
    "id": "stone",
    "name": "Cairn Halls",
    "minFloor": 1,
    "tileRgb": "60,70,55",
    "monsterHpMult": 1.0,
    "gravityPctBonus": 0,
    "desc": "Old passage-tombs, half-swallowed by moss. Standard difficulty.",
    "moteColor": "#cfc6b0",
    "terrainType": "sacred",
    "terrainShapes": [
      "S",
      "L",
      "J"
    ]
  }
]
